{
  "schema_version": "1.0",
  "generated_at": "2026-10-13T00:30:29+08:00",
  "generator": {
    "name": "askback-student-simulator",
    "mode": "template",
    "model": null,
    "fallback_reason": null
  },
  "unit": {
    "platform": "均一教育平台",
    "subject": "數學",
    "grade": "六年級",
    "semester": "下學期",
    "unit_id": "math-g6-frac-div",
    "unit_name": "分數的除法",
    "unit_code": "M6-N-3",
    "topics": [
      "分數除法",
      "分數四則運算"
    ]
  },
  "student": {
    "name": "小明",
    "grade": "六年級",
    "age": 11,
    "region": "台灣",
    "language": "zh-TW",
    "character": {
      "persona": "台灣國小六年級男生，約 11–12 歲，住在城市、就讀公立國小。好奇心強、愛說話，遇到想不通的題目會自言自語，不太會藏問題，會直接把腦袋裡的錯誤推理說出來。對升學有點壓力，但本性單純，會老實承認「我不知道」。",
      "speech_style": "口語、短句、繁體中文台灣用語；常用「耶、啦、喔、蛤、可是、這樣」等語氣詞；會重複自己的疑問；會先講自己的做法再講卡住的地方；句子不會太長，偶爾語氣停頓。",
      "vocabulary_notes": "使用國小六年級數學／自然科詞彙（分數、除法、分子分母、正負數、電路），分數以中文讀法念出（例如「七分之四」）。",
      "avoid": [
        "書面語與成語",
        "教師口吻或解釋正確作法",
        "自我修正成正確答案",
        "過於成熟的用詞（例如『筆者認為』『綜上所述』）",
        "大陸用語（例如『做作业』）"
      ]
    },
    "voice": {
      "locale": "zh-TW",
      "style": "自然、親切、語速稍快的 11–12 歲學生口吻",
      "synthetic": true,
      "note": "一律使用一般合成語音，不冒充真實兒童或未授權的特定人物聲音。"
    }
  },
  "misconception": {
    "id": "mc-math-g6-frac-div-01",
    "type": "規則誤用（分子分母分別相除）",
    "sticking_point": "分數除以分數時，不知道該用什麼方法計算",
    "statement": "分數除分數，就是分子除以分子、分母除以分母",
    "display_problem": "七分之四 ÷ 五分之三",
    "faulty_reasoning": [
      {
        "step": 1,
        "thought": "除法就是前面的數跟後面的數對應相除"
      },
      {
        "step": 2,
        "thought": "分子 4 ÷ 分子 3，分母 7 ÷ 分母 5"
      },
      {
        "step": 3,
        "thought": "四除以三、七除以五都除不盡，一定是數字太奇怪"
      }
    ],
    "why_it_feels_right": "分數加減法都是分子跟分子、分母跟分母對應處理，除法應該也一樣",
    "forbidden_answer_terms": [
      "正確答案",
      "正解",
      "解答是",
      "顛倒相乘",
      "倒數相乘",
      "乘以倒數",
      "二十一分之二十",
      "20/21",
      "21分之20"
    ],
    "unit_id": "math-g6-frac-div",
    "line_hints": [
      {
        "scene": "intro",
        "expression": "neutral"
      },
      {
        "scene": "problem",
        "expression": "curious"
      },
      {
        "scene": "reasoning",
        "expression": "think"
      },
      {
        "scene": "doubt",
        "expression": "confused"
      },
      {
        "scene": "doubt",
        "expression": "worried"
      },
      {
        "scene": "recall",
        "expression": "think"
      },
      {
        "scene": "puzzle",
        "expression": "puzzled"
      },
      {
        "scene": "ask",
        "expression": "hopeful"
      }
    ]
  },
  "question": {
    "original_text": "我是小明，今天在均一寫數學練習題。這一題是七分之四除以五分之三。我想了很久，覺得應該分子除以分子，分母除以分母。可是四除以三、七除以五，都除不盡耶。這樣不就要四捨五入？答案會變得很奇怪。老師上次有教過一個特別的口訣，可是我一直覺得那只是硬背，說不通。難道是我哪裡搞錯了？還是這一題本來就不能算？有沒有人可以告訴我，問題到底出在哪裡？",
    "lines": [
      "我是小明，今天在均一寫數學練習題。",
      "這一題是七分之四除以五分之三。",
      "我想了很久，覺得應該分子除以分子，分母除以分母。",
      "可是四除以三、七除以五，都除不盡耶。",
      "這樣不就要四捨五入？答案會變得很奇怪。",
      "老師上次有教過一個特別的口訣，可是我一直覺得那只是硬背，說不通。",
      "難道是我哪裡搞錯了？還是這一題本來就不能算？",
      "有沒有人可以告訴我，問題到底出在哪裡？"
    ],
    "tone": "困惑、有點著急",
    "topics": [
      "分數除法",
      "分數四則運算"
    ],
    "language": "zh-TW"
  },
  "interaction": {
    "mode": "single",
    "turns": [
      {
        "turn": 1,
        "role": "student",
        "text": "我是小明，今天在均一寫數學練習題。這一題是七分之四除以五分之三。我想了很久，覺得應該分子除以分子，分母除以分母。可是四除以三、七除以五，都除不盡耶。這樣不就要四捨五入？答案會變得很奇怪。老師上次有教過一個特別的口訣，可是我一直覺得那只是硬背，說不通。難道是我哪裡搞錯了？還是這一題本來就不能算？有沒有人可以告訴我，問題到底出在哪裡？"
      }
    ]
  },
  "safety": {
    "answer_leak": {
      "leaked": false,
      "checked_terms": [
        "20/21",
        "21分之20",
        "乘以倒數",
        "二十一分之二十",
        "倒數相乘",
        "應該這樣算",
        "正確方法是",
        "正確的解法",
        "正確答案",
        "正解",
        "正解[是為]",
        "答案是",
        "解答是",
        "顛倒相乘"
      ],
      "notes": "未偵測到標準解答或教師講解字樣。"
    },
    "scope": [
      "本階段僅呈現學生迷思與提問",
      "不產生 AI 教學設計師或 instructional_design.json",
      "不產生教師端迷思診斷報告",
      "不生成正確答案或教師講解"
    ]
  },
  "provenance": {
    "ai_generated_student": true,
    "disclaimer": "AI 生成學生示範",
    "purpose": "呈現 AI 學生的迷思、困惑與提問，非真實學生紀錄，也非教學示範答案"
  }
}
